{
  "$schema": "https://json-schema.org/draft/2020-12/schema",
  "$id": "https://agentvst.dev/schema/plugin.schema.json",
  "title": "AgentVST Plugin Specification",
  "type": "object",
  "additionalProperties": false,
  "properties": {
    "plugin": {
      "$ref": "#/$defs/pluginMetadata"
    },
    "parameters": {
      "type": "array",
      "items": {
        "$ref": "#/$defs/parameter"
      }
    },
    "groups": {
      "type": "array",
      "items": {
        "$ref": "#/$defs/group"
      }
    },
    "dsp_routing": {
      "type": "array",
      "items": {
        "$ref": "#/$defs/dspRoute"
      }
    }
  },
  "$defs": {
    "pluginMetadata": {
      "type": "object",
      "additionalProperties": false,
      "properties": {
        "name": {
          "type": "string",
          "minLength": 1
        },
        "version": {
          "type": "string",
          "minLength": 1
        },
        "vendor": {
          "type": "string",
          "minLength": 1
        },
        "category": {
          "type": "string",
          "minLength": 1
        }
      }
    },
    "parameter": {
      "type": "object",
      "additionalProperties": false,
      "required": [
        "id",
        "name"
      ],
      "properties": {
        "id": {
          "type": "string",
          "pattern": "^[A-Za-z_][A-Za-z0-9_]*$"
        },
        "name": {
          "type": "string",
          "minLength": 1
        },
        "type": {
          "type": "string",
          "enum": [
            "float",
            "int",
            "boolean",
            "enum"
          ]
        },
        "min": {
          "type": "number"
        },
        "max": {
          "type": "number"
        },
        "default": {},
        "step": {
          "type": "number",
          "minimum": 0
        },
        "skew": {
          "type": "number",
          "exclusiveMinimum": 0
        },
        "unit": {
          "type": "string"
        },
        "group": {
          "type": "string"
        },
        "options": {
          "type": "array",
          "items": {
            "type": "string",
            "minLength": 1
          },
          "minItems": 1,
          "uniqueItems": true
        }
      },
      "allOf": [
        {
          "if": {
            "properties": {
              "type": {
                "const": "boolean"
              }
            }
          },
          "then": {
            "properties": {
              "default": {
                "type": "boolean"
              }
            }
          }
        },
        {
          "if": {
            "properties": {
              "type": {
                "const": "enum"
              }
            },
            "required": [
              "type"
            ]
          },
          "then": {
            "required": [
              "options"
            ],
            "properties": {
              "default": {
                "type": "integer",
                "minimum": 0
              }
            }
          }
        },
        {
          "if": {
            "properties": {
              "type": {
                "const": "int"
              }
            },
            "required": [
              "type"
            ]
          },
          "then": {
            "required": [
              "min",
              "max"
            ],
            "properties": {
              "default": {
                "type": "number"
              }
            }
          }
        },
        {
          "if": {
            "properties": {
              "type": {
                "const": "float"
              }
            }
          },
          "then": {
            "required": [
              "min",
              "max"
            ],
            "properties": {
              "default": {
                "type": "number"
              }
            }
          }
        },
        {
          "if": {
            "not": {
              "required": [
                "type"
              ]
            }
          },
          "then": {
            "required": [
              "min",
              "max"
            ],
            "properties": {
              "default": {
                "type": "number"
              }
            }
          }
        }
      ]
    },
    "group": {
      "type": "object",
      "additionalProperties": false,
      "required": [
        "id"
      ],
      "properties": {
        "id": {
          "type": "string",
          "pattern": "^[A-Za-z_][A-Za-z0-9_]*$"
        },
        "name": {
          "type": "string",
          "minLength": 1
        },
        "parameters": {
          "type": "array",
          "items": {
            "type": "string"
          },
          "uniqueItems": true
        }
      }
    },
    "dspRoute": {
      "type": "object",
      "additionalProperties": false,
      "required": [
        "source",
        "destination"
      ],
      "properties": {
        "source": {
          "type": "string",
          "minLength": 1
        },
        "destination": {
          "type": "string",
          "minLength": 1
        },
        "parameter_link": {
          "type": "object",
          "additionalProperties": {
            "type": "string",
            "minLength": 1
          }
        }
      }
    }
  }
}
